Colonne1;year;record_number;pages;catalogue_title;authors
73886;1949;73897;[6];New book currency now in circulation;
73886;1949;73898;[7];Study abroad: over 10,500 awards in fellowship handbook;
73886;1949;73899;[7];National groups end first world meeting;
73886;1949;73900;[7];Education missions leaving for Philippines, Afghanistan;
73886;1949;73901;[7];Experts make plans to assist intellectual and M.E. refugees;
73886;1949;73902;[10];On the threshold of 1949: the new UNESCO programme;
73886;1949;73904;[10];Reconstructing the damages of war;
73886;1949;73905;[11];A Broad educational programme for people of all ages;
73886;1949;73906;[12, 13];The Natural, the social sciences;
73886;1949;73907;[13];Cultural activity: philosophy and humanistic studies;
73886;1949;73908;[12, 13];The UNESCO budget for 1949;
73886;1949;73909;[14];Cultural interchange between countries;
73886;1949;73910;[14];UNESCO's fellowship programme;
73912;1949;73913;[2];The Need for professional training of journalists;Desmond, Robert William
73912;1949;73915;[2];Problems of UNESCO;
73912;1949;73916;[2];UNESCO official decries press 'scandal' reports;Laves, Walter Herman Carl
73912;1949;73917;[3, 11];Schuman, Bidault welcome Torres Bodet at French National Commission;
73912;1949;73918;[3];UNESCO maps vast programme on human rights;
73912;1949;73919;[3];UNESCO sets up priority system for 1949 work;
73912;1949;73920;[3];"France, Ecuador become first nations to adopt ""Human Rights Day""";
73912;1949;73921;[4];A Manifesto of the International Music Fund;
73912;1949;73922;[4];Musicologists create World Council;
73912;1949;73923;[5];These are children of Europe: dismal serenade;
73912;1949;73925;[6, 7, 8];Somewhere in Europe: a photographer highlights the drama of post-war youngsters;
73912;1949;73926;[9, 11];Teen-age 'républicains' plug for world federation;
73912;1949;73927;[9, 11];What is being done to heal the wounds?;Pile, W.D.
73912;1949;73929;[10];Indian demographer looks at world population problems;Chandrasekhar, Sripati
73912;1949;73930;[10];Humanists set up international body with UNESCO support;
73912;1949;73931;[10];U.S. Conference to stress group, individual action for UNESCO;
73912;1949;73932;[11];A New Zealander views UNESCO educational missions;Beeby, Clarence Edward
73912;1949;73934;[12];The Case against and for 'comic books';
73912;1949;73935;[12];Did your local radio carry this news?;
73938;1949;73939;[1, 7];The Internationalist;Bohr, Niels
73938;1949;73940;[2];Is a world council of philosophy really necessary?;Fawtier, Robert
73938;1949;73942;[2];UNESCO reports education needs of M.E. refugees;
73938;1949;73943;[3];Book Coupon Scheme proving a success;
73938;1949;73944;[3];Canada, United States set up book exchange centres;Zuckerman, J.
73938;1949;73945;[4];University of the Air: radio organizations agree on plans for series of world university programmes to start next October;
73938;1949;73946;[4];At Paris headquarters UNESCO initiates fortnightly student evening discussions;
73938;1949;73947;[4];67 Nations discuss future of short-wave frequencies;
73938;1949;73948;[9, 10, 11];The Mission of UNESCO;
73938;1949;73949;[5];The Voluntary work camp: a rewarding adventure for peace with youngsters from many lands;
73938;1949;73950;[6];W.H.O. stresses importance of joint action with UNESCO;Handler, Joseph
73938;1949;73951;[6];Benefits to man-in-street seen in world medical council;
73938;1949;73952;[6];Over 3,000 to attend UNESCO conference in US this month;
73938;1949;73953;[7];The Scientist;Compton, A.H.
73938;1949;73954;[7];Seeker after peace;Hadamard, Jacques
73938;1949;73955;[8];Cleaning up China's illiteracy: the story of the 'Little teacher' system as it works in Shangai;Koo, Portia
73956;1949;73957;[1, 2];Thousands join in UNESCO rally at Cleveland;
73956;1949;73958;[2];Care' to ship books to schools, libraries;
73956;1949;73960;[3, 4];UNESCO: a personal faith;
73956;1949;73961;[5];Food and people;
73956;1949;73962;[6, 7, 8, 9];The Double crisis;Huxley, Aldous
73956;1949;73963;[7, 8];The Way out;Russell, John
73956;1949;73964;[9];Population problems of India and Pakistan;Chandrasekhar, Sripati
73956;1949;73965;[10];Hamlet's castle prepares for adult education meeting;
73956;1949;73966;[10];Siam making all-out drive to improve school system;Orata, Pedro T.
73956;1949;73967;[11];UNESCO sponsors history of science publications;Pelseneer, Jean
73956;1949;73968;[11];Health experts set up World Medical Council;Handler, Joseph
73956;1949;73969;[12];Masaccio: a portfolio of high quality colour reproductions;
73970;1949;73971;[];Geography for world understanding;
73970;1949;73972;[3, 4];Teachers hold key to UNESCO aims', Director-General states;
73970;1949;73973;[3];Four zones of Germany to profit from UNESCO-created book centre;
73970;1949;73974;[3];New literacy drives launched in America;
73970;1949;73975;[4];Paris educators' conference stresses world point of view;
73970;1949;73976;[4];Summer camp for war orphans to open in France;
73970;1949;73977;[4];Grass roots' internationalism achieves positive results: Wichita-Orleans;
73970;1949;73978;[5];India in the world today;
73970;1949;73979;[6];Nai talim': the Gandhi method of 'education for life';Kabir, Humayun
73970;1949;73980;[6, 7];Indian literatures and the impact of the West;Dhingra, Baldoon
73970;1949;73982;[6, 7];Rabindranath Tagore: sentinel of the East;
73970;1949;73983;[7, 9];Scientific strides of modern India: towards industrialization;Sen, S.N.
73970;1949;73984;[7];System of 'untouchables' abolished;
73970;1949;73985;[8];The Artistic revival in India: music, the dance, painting;Rao, Raja
73970;1949;73986;[8];Contemporary Indian films for international understanding;Abbas, Kwaja Ahmad
73970;1949;73987;[9];Population problems of India and Pakistan;Chandrasekhar, Sripati
73970;1949;73988;[10, 12];More newsprint production urged;
73970;1949;73989;[10];World radio caravan' proposed for UNESCO;
73970;1949;73991;[10];D. Schneider, C. a Prato named to key UNESCO posts;
73970;1949;73992;[11];What is 'democracy'?;
73993;1949;73994;[3];Experts review UNESCO Programme in Germany, suggest expansion;
73993;1949;73995;[3, 9];Major campaign to cut frontier barriers to education exchange;Behrstock, Julian
73993;1949;73996;[4];Preservation of nature;Gille, Alain
73993;1949;74002;[5, 6, 7, 8, 9];The Rebirth of a valley: how the peasants of Marbial helped make the Haiti Pilot Project a success;
73993;1949;74003;[6, 7, 8];The Story of the Haiti 'Pilot Project';
73993;1949;74006;[9];UNESCO review;
73993;1949;74007;[10];A French foreign legionnaire and Paris 'dead-end' kids;
73993;1949;74009;[11];The Librarians join hands: a new venture in world publications exchanges;
73993;1949;74010;[11];UNESCO book shelf;
73993;1949;74011;[12];World 'Cité des arts' to be created in heart of Paris;
73993;1949;74012;[12];UNESCO prepares Chopin 'memorial';
74013;1949;74014;[1];UNESCO Board votes emergency aid for Greek refugee children;
74013;1949;74015;[1, 2];UNESCO creates Regional Office in western hemisphere;
74013;1949;74016;[2];A Blueprint of directives;
74013;1949;74017;[3];The School-bell in the wilderness: aid to Middle East refugee schools;Vliet, W. van
74013;1949;74018;[3];UNESCO sponsors camp schools for Middle East refugee children;
74013;1949;74019;[4];UNESCO to start Feature Service for world press on July 15;
74013;1949;74020;[4];School broadcasting: experts urge creation of UNESCO world information centre;
74013;1949;74021;[5, 8];Adult education;Lombard, Robert|Bloch-Michel, Jean
74013;1949;74022;[6, 8];100 years of the Danish folk high school movement;Frisch, Hartvig
74013;1949;74023;[6, 7];Adult education and the future of our civilization;
74013;1949;74024;[9];A Problem of vital concern to all scientists...;
74013;1949;74025;[9];The Role of scientific abstracting journals;Flynn, John E.
74013;1949;74026;[10, 11];UNESCO maps aid plan for 'backward' areas;
74013;1949;74027;[11];The Latin American struggle against illiteracy;
74013;1949;74028;[12];The Story of Antonio Arango: a UNESCO 'Food and people' pamphlet;Nannetti, Guillermo
74029;1949;74030;[1];UNESCO salutes Goethe's memory;
74029;1949;74031;[2];Public education conference meets at Geneva;
74029;1949;74032;[3];"I.T.I. Congress meets: ""the theatre is a living force""";
74029;1949;74033;[3];Film star with Unescan outlook visits the 'Courier': Myrna Loy says...;
74029;1949;74034;[4];Young scientists shake hands across the borders;
74029;1949;74035;[4, 9];Education and natural resources;Scott, David
74029;1949;74036;[5, 6, 7, 8];Popularization of science;
74029;1949;74037;[5];The Choice for man: a good life or an unhappy death;Davis, Watson
74029;1949;74039;[5, 8];We must increase the dosage of science;Talice, Rodolfo
74029;1949;74040;[6];Lord Boyd-Orr helped to make an A1 nation;Calder, Ritchie
74029;1949;74041;[7];Emotionalism in science;
74029;1949;74042;[6, 7];More use must be made of the public cinema;Elton, Arthur|Road, Sinclair
74029;1949;74043;[7, 8];The Role of cheap books;Crammer, J.L.
74029;1949;74045;[8];Science through television opens a new field;Weston, R. Mc V.
74029;1949;74046;[9];Boys' town in Italy;
74029;1949;74047;[9];Czech five-year plan for culture;
74029;1949;74049;[10];Economic and Social Council approves UNESCO report;
74029;1949;74050;[11];Goethe and Germany;Croce, Benedetto
74029;1949;74051;[11];The Complete man;Spender, Stephen|Romains, Jules
74029;1949;74052;[12];Colour reproduction: UNESCO's first travelling exhibition;
74029;1949;74053;[12];Edvard Munch;Lardera, Berto
74029;1949;74054;[12];Art critics meet at UNESCO House;
74055;1949;74056;[2];Food from the sea;Lind, Lars
74055;1949;74058;[2];Most of the world: an American survey;Carter, William D.
74055;1949;74059;[3];U.N. Technical aid plan approved by ECOSOC;
74055;1949;74060;[3];Economic Council reviews UNESCO aid proposals;
74055;1949;74061;[4];Technical aid to underdeveloped countries;
74055;1949;74062;[5];A Letter from Quitandinha;Nannetti, Guillermo
74055;1949;74063;[5];Classical studies and UNESCO;Hoeg, Carsten
74055;1949;74065;[6];A Thousand years ago... Avicenna Persian scientist and philosopher, brought knowledge to the West;Aboussouan, Camille
74055;1949;74066;[7];Mass communication: experts review technical needs of press, film and radio;
74055;1949;74067;[7, 8];Remove the barriers;Behrstock, Julian
74055;1949;74068;[7];Famine threatens man;Duberg, Peter
74055;1949;74069;[8];UNESCO Features: a world press service;
74055;1949;74070;[8];UNESCO on the air;
74055;1949;74071;[9];Human rights: UNESCO exhibition in Paris;
74055;1949;74072;[9];Human rights and public opinion;
74055;1949;74073;[10];An Index card stopped an epidemic;
74055;1949;74074;[10];Figures that hit;
74055;1949;74075;[11];Science liaison spans the world;
74055;1949;74076;[11];Food and people;
74055;1949;74077;[12];National Commissions' vital role;
74055;1949;74078;[13, 14, 15, 16, 17];The Fourth session of the General Conference of UNESCO will be held in Paris 19th September - 4th October 1949;
74055;1949;74079;[14];Germany and Japan;
74055;1949;74081;[15];UNESCO Director-General presents budget estimates: million dollar increase requested;
74055;1949;74082;[16, 17];Faith in UNESCO;
74055;1949;74083;[16, 17];The Directives;
74055;1949;74084;[16];Some of UNESCO's achievements during 1949;
74055;1949;74085;[18];Free movement of persons and educational, scientific and cultural material;
74055;1949;74086;[18];International work camps;
74055;1949;74087;[19];International circulation of publications;
74055;1949;74088;[19];UNESCO's contribution to libraries reconstruction and development;
74055;1949;74089;[30];Children's communities;
74055;1949;74090;[21];A Colonial Arts Council?;Huxley, Julian
74055;1949;74091;[21];India's health is her job;Behrman, Daniel
74055;1949;74092;[22];Education: UNESCO's programme;Beeby, Clarence Edward
74055;1949;74093;[22];The Viani Associated Project;
74055;1949;74094;[23];Seminars in 1950: an announcement by the Director-General;
74055;1949;74095;[23];What is UNESCO doing for: adults, children, universities, child war victims;
74055;1949;74096;[24];Reconstruction still comes first;
74055;1949;74097;[25];Work camps for peace;
74055;1949;74099;[26];UNESCO fellows report progress;
74055;1949;74100;[26];Les chemins de la paix;
74055;1949;74101;[27];Study abroad covers world fellowship field;
74055;1949;74102;[27];Experts to discuss exchanges;
74055;1949;74103;[28];The Outlook for social science;Ramos, Arthur
74055;1949;74104;[28];Social science: organizing research;
74055;1949;74105;[28];UNESCO plans world census of works on social science;Godchot, J.E.
74055;1949;74106;[29];Half the world's population is illiterate;
74055;1949;74107;[30];Arts and letters: UNESCO's programme;Piovene, Guido
74055;1949;74108;[30];Art in general education;
74055;1949;74109;[30];The Museums Division;
74055;1949;74110;[31];A Tribute to Frédéric Chopin;
74055;1949;74111;[31];Freedom of the artist;
74055;1949;74112;[31];Libraries' task in community education;
74055;1949;74114;[32];Art in Central America;Enquin, Ricardo
74116;1949;74117;[2];In Brazil educators stirred by new approach to continental campaign against illiteracy;
74116;1949;74118;[3];Concentrated programme' for UNESCO urged by delegates to 4th General Conference;
74116;1949;74119;[3, 4];There must be no question of a devaluation of UNESCO;Lombard, Robert
74116;1949;74120;[4];The Duties of the State in regard to education, science and culture;
74116;1949;74121;[5];Universal rights: UNESCO exhibition opens in Paris October - December 1949;
74116;1949;74122;[6, 7];The Rights of man through the ages;
74116;1949;74123;[8];The Universal Declaration;
74116;1949;74124;[9, 10];An Act of self-examination: past endeavours future action;
74116;1949;74125;[11];Greek refugees must have aid before the winter;
74116;1949;74126;[12];Saving our resources;Sam, Eleen
74116;1949;74128;[12];Cartoons and films in China;
74116;1949;74129;[13];Universal Declaration of Human Rights: text adopted on December 10, 1948 by the General Assembly of the United Nations;
74130;1949;74131;[2];National Commissions draw blueprint for Florence Meeting;Mc Phee, Lorna
74130;1949;74132;[2];One hundred non-governmental organizations now working with UNESCO;Hercik, V.
74130;1949;74133;[3];Budget for 1950 8,000,000 dollars;
74130;1949;74134;[3];Les chapitres du budget;
74130;1949;74136;[4, 5];UNESCO clears the way for Florence;
74130;1949;74137;[5];United Nations Day, 24 October;
74130;1949;74139;[6, 7];Tasks for world understanding defined at UNESCO international debate;Bidault, Georges|Niebuhr, Reinhold|Fombona, E. Zerega|Piaget, Jean|Hercik, F.|Dupreel, Eugène Gustave|Russell, Bertrand
74130;1949;74140;[6];Dans le coeur d'un homme on peut trouver tous les hommes;Bidault, Georges
74130;1949;74141;[7];La sensibilité humaine;Fombona, E. Zerega
74130;1949;74142;[7];Désarmement moral;Siassi, Recteur
74130;1949;74143;[6];L'action culturelle et spirituelle est liée au pouvoir politique et militaire;Niebuhr, Reinhold
74130;1949;74144;[7];L'amour de la paix;Hercik, E.
74130;1949;74146;[6];Un étendard international pour les écoles !;Russell, Earl
74130;1949;74147;[7];Symbiose sociale;Dupreel, Eugène Gustave
74130;1949;74148;[8];A Sightless soldier works for the blind;Behrman, Daniel
74130;1949;74149;[8];Has UNESCO anything to declare?;
74130;1949;74150;[9];Integration is keynote of UNESCO's 1950 education programme;Cheng Chi-Pao
74130;1949;74151;[9];Professor Jean Piaget, psychologist and educator;
74130;1949;74152;[9];Dr. Beeby: an appreciation;
74130;1949;74154;[10];Experts review educational interchange programmes;
74130;1949;74155;[10];UNESCO's exchange of persons programme to be extended in 1950;
74130;1949;74156;[10];"Bari holds a ""UNESCO Day""";
74130;1949;74157;[11];Pattern of UNESCO's reconstruction work for 1950;Drzewieski, Bernard
74130;1949;74158;[11];Press, radio, film;
74130;1949;74159;[12, 13];Why we fight;
74130;1949;74160;[12];Trygve Lie commends UNESCO's work for Palestine refugees;
74130;1949;74161;[13];Appeal on behalf of Greek children;
74130;1949;74162;[12, 13];Appeal on behalf of refugee children in the Middle East;
74130;1949;74163;[14];The Question of race and the democratic world;Ramos, Arthur
74130;1949;74164;[14];Political scientists form first international association;
74130;1949;74165;[15];"Scientists ""in front line""";
74130;1949;74166;[16];UNESCO's cultural activities;
74130;1949;74167;[16];Art and education;Thomas, Trevor
74130;1949;74168;[16];UNESCO catalogue lists recorded works of Chopin;
74130;1949;74169;[17];Case dei bambini became model for the world;
74130;1949;74170;[17];Italy's damaged art treasures are losing their scars;
74130;1949;74171;[18, 19];UNESCO's Germany, Japan programmes endorsed by General Conference;
74130;1949;74173;[19];Illiteracy and hunger: twin evils of Asia;
74130;1949;74174;[20];The Work of the General Conference as viewed by delegates;
74130;1949;74175;[20];"Student groups ""behind the scenes"" at UNESCO Conference";Skaff, Georges N.
74130;1949;74176;[21];English architect designed human rights exhibition;
74130;1949;74177;[22];New charter defines code for Latin American universities;
74130;1949;74178;[22];Congress of Americanists extends international cultural ties;
74130;1949;74179;[22];Latin American organizations to tell U.N. story;
74130;1949;74180;[23];Children of the street: urgent problem of post-war child vagrants studied at Charleroi Conference;
74130;1949;74181;[23];Folk arts must be saved;
74130;1949;74182;[24];"Florence ""where the spirit lives"" will welcome UNESCO in May 1950";Lardera, Berto
74184;1949;74185;[3];Folk arts in the path of civilization;Métraux, Alfred
74184;1949;74186;[4];Preserving cultural values in a changing world;Mayoux, Jean Jacques
74184;1949;74187;[4];"Index translationum: a ""Bible"" for publishers, writers and translators";
74184;1949;74189;[5];War broke fabric but not the spirit of Rennes University;
74184;1949;74190;[5];Spreading science throughout the world;
74184;1949;74192;[6, 7];Mysore: a new hope for an old continent;
74184;1949;74193;[8];"Educators must help establish ""techniques of peace""";
74184;1949;74194;[8];Operation T.I.C.E.R.: the story of volunteers in the front line of educational reconstruction;
74184;1949;74195;[9];Portrait of a people;
74184;1949;74196;[10];UNESCO Radio Caravan to record post-war children's story;
74184;1949;74198;[10];A Magic carpet for children;
74184;1949;74199;[10];The Public library;
74184;1949;74200;[10];Le bébé pèse deux tonnes;
74184;1949;74203;[11];"UNESCO seminars are guiding ""world community"" educators";
74184;1949;74205;[11];Arthur Ramos, 1903-1949;
74184;1949;74206;[12];"Ancient treasures: their conservation and restoration, ""trustee"" countries must safeguard mankind's artistic heritage";
74946;1950;74217;[3];L'UNESCO définit les bases de sa coopération avec les Organisations régionales;
74946;1950;74218;[3];Great Unescan becomes head of Executive Board;
74946;1950;74221;[4];"The First ""Human Rights"" anniversary";
74946;1950;74222;[4];The Doctor who opened a new door to education;
74946;1950;74224;[5];World task seen through eyes of youth;
74946;1950;74228;[8];Amabel Williams-Ellis;
74946;1950;74230;[9];La Déclaration des droits de la femme à l'éducation et à la culture prend le sens d'un appel;UNESCO. Director-General, 1948-1952 (Torres Bodet, Jaime)
74946;1950;74236;[11];An Answer for the future;
74968;1950;74242;[3];Mexican education centre will serve a continent;
74968;1950;74243;[3];Dr Mendez-Pereira to direct first UNESCO regional office;
74968;1950;74244;[4];Testimony of the twentieth century pioneers;
74968;1950;74246;[4];UNESCO-IBE: a partnership working to improve world education;
74968;1950;74247;[4];Human rights message will be spread by travelling exhibition;
74968;1950;74253;[10];Helping world's engineers to speak the same language;
74968;1950;74254;[10];Science is everyone's business;
74968;1950;74255;[10];Has the twentieth century room for Malthus?;Mayer, André
74968;1950;74256;[11];The Slaves who claimed their rights as men;
74968;1950;74257;[11];Some anniversaries during February 1950;
74968;1950;74258;[11];A Young republic wants to join UNESCO;
74977;1950;74261;[2];UNESCO helps educational films over frontier barriers;
74977;1950;74263;[2];(Julian Huxley);
74977;1950;74265;[3];Guide books to a better way of life;
74977;1950;74266;[4];Three months progress in UNESCO's world task;
74977;1950;74268;[4];Dr. W.H.C. Laves resigns his post as Deputy Director-General of UNESCO;
74977;1950;74271;[6, 7];"Men against the desert: a new Sahara 'garrison'; the desert scientists";Calder, Ritchie
74977;1950;74272;[7];Goodbye to another illusion: the rainless desert;Calder, Ritchie
74977;1950;74273;[7];Ploughshares have replaced rifles in the Sahara;Calder, Ritchie
74977;1950;74275;[8];In a Vienna kindergarten handicapped children can be 'the lucky ones';
74977;1950;74276;[8];A 'Ray of sunshine' in the laboratory;
74977;1950;74277;[8];UNESCO reports on one year's reconstruction;
74977;1950;74280;[9];What is pneumonoultramicroscopicsilicovolcanokoniosis?;
74977;1950;74282;[10];It happened in March...;
74977;1950;74285;[11];A Better chance for young composers;
81286;1950;74288;[2];UNESCO acts to free books, art, films from customs charges;
81286;1950;74292;[3];The Teacher's words...;
81286;1950;74293;[3];Films teach a new lesson at Shih Tze Hsiang;
81286;1950;74294;[4];Youth has a plan and a stake in building a new world;
81286;1950;74297;[4];Executive Board reviews UNESCO work plan for 1951;
81286;1950;74298;[4];A Royal visitor to UNESCO House;
81286;1950;74300;[5];Technical assistance: a two-way traffic;Buck, Pearl S.
81286;1950;74301;[6];The Twentieth century cares relatively little for the creators of those same works of art to which it attaches such importance;
81286;1950;74304;[6];Artists: how they live is nobody's business;
81286;1950;74305;[7];To free art, first free mens' minds;
81286;1950;74313;[9];Men who fight for world's right to health;
81286;1950;74314;[9];Science and man: 1950;
81370;1950;74321;[2];A Hundred groups with a common aim;
81370;1950;74323;[2];Tributes to two great internationalists;
81370;1950;74329;[5];Italy, host to UNESCO's Conference, welcomes M. Torres Bodet;
81370;1950;74331;[6, 7];The World laughs at different things;
81370;1950;74334;[9];The Lesson became a crusade;
81370;1950;74335;[9];Two new UNESCO science services;
81370;1950;74337;[10];Film news in brief;
81400;1950;74352;[4];Scattered Arab manuscripts collected and microfilmed;
81475;1950;74378;[3];What is not good for humanity as a whole cannot be good for any nation, race or individual;UNESCO. Director-General, 1948-1952 (Torres Bodet, Jaime)
81475;1950;74381;[6];Six new UNESCO Executive Board members elected by the General Conference;
81475;1950;74391;[11];Food and people booklets aid educational drive in U.S.;
81475;1950;74396;[13];Dutch painters put sky views on canvas;
81475;1950;74398;[13];It happened in July;
81475;1950;74402;[15];It happened in August;
81543;1950;74404;[2];A Hundred groups with a common aim;
81543;1950;74408;[3];ECOSOC resolution on Korea: UNESCO Executive Board meets;
81543;1950;74416;[8];Study of Brazilian ethnic groups will help UNESCO to fight race prejudice;
81543;1950;74423;[12];The Sign on the front door;Tabbush, Yvonne
81564;1950;74441;[10];Europe's orphans learn to live again and to laugh;
81564;1950;74442;[10];UNESCO - CARE Programme is helping war hit libraries;
81564;1950;74444;[11];It happened in October;
81592;1950;74450;[2];Educators seek answers to problems of primary schools in the Americas;
81592;1950;74461;[8];UNESCO asks five nations to aid in high altitude research work;
81592;1950;74468;[11];It happened in November...;
81616;1950;74472;[2];Committee for UNESCO activities established in Western Germany;
81616;1950;74473;[2];The Making of the first peace pipe;
81616;1950;74477;[3];Prominent American educator to become new Deputy Director-General of UNESCO;
81616;1950;74478;[5];To help all men forsee a future;UNESCO. Director-General, 1948-1952 (Torres Bodet, Jaime)
81616;1950;74489;[8];Films: a universal medium to propagate a Universal Declaration;
81616;1950;74496;[11];It happened in December...;
81616;1950;74499;[3];The Universal Declaration of Human Rights;
73774;1948;74502;[1, 2];Work-plan for Germany prepared by Secretariat;
73790;1948;74503;[1, 3];Museum directors gather at first World Conference;
73809;1948;74504;[3];Pacific Science Congress given UNESCO grant;
73809;1948;74505;[3];Emergency Credits Plan studied;
74589;1951;74591;[6];The Arts are not just a pleasant pastime;Ziegfeld, Edwin
74589;1951;74592;[6, 7];Do it your own way;Fradier, Georges
74589;1951;74593;[10];Child art as a growing force in education;Gaitskell, C.D.
74589;1951;74594;[11];Stories in clay by children under ten;El-Bassiouny, Mahmoud
74589;1951;74596;[12];Paris: how 80 children aged 9-14 see the capital of France;
74589;1951;74597;[5, 6, 7, 8, 9, 11, 12];Children as creative artists;
74589;1951;74598;[3, 4];"The 1951 General Conference of UNESCO: ""a meeting of great decisions""";
74589;1951;74599;[13];Fundamental particles: what are they?;Freeman, Ira M.
74589;1951;74600;[13];The Modern calculating machine: an aid to man in his fight for progress;Goldsmith, Maurice
74589;1951;74601;[14];The Right to free and compulsory education;Debiesse, Jean
74589;1951;74602;[15];The Paradox of British humour;Matthews, Ronald|Bret, P.L.
74589;1951;74603;[14];Science and newsprint;
