Colonne1;year;record_number;pages;catalogue_title;authors
111392;1998;111405;[46, 47];It's rumba time!;Leymarie, Isabelle
111392;1998;111406;[48, 49, 50];Interview with Izet Sarajlic;Sopova, Jasmina
111704;1998;111705;[4, 5, 6, 7];Science and social responsibility;Kutukdjian, Georges B.
111704;1998;111706;[8, 9, 10, 11, 12, 13];Energy: a fair deal for all;Audouze, Jean
111704;1998;111707;[14, 15, 16, 17];The Right to know;Ashford, Nicholas A.
111704;1998;111708;[18, 19, 20];The Ethics of conservation, 1: The natural world;Bennett, Gordon|Lopoukhine, Nikita
111704;1998;111709;[21, 22];The Ethics of conservation, 2: The cultural heritage;Bennett, Gordon|Lopoukhine, Nikita
111704;1998;111710;[23, 24, 25, 26, 27, 28];How predictable is nature?;Fenstad, Jens Erik
111704;1998;111711;[29, 30, 31, 32, 33];Genetic testing and discrimination;Kirby, Michael
111704;1998;111712;[34, 35];The Universal Declaration on the Human Genome and Human Rights;
111704;1998;111713;[36, 37];A Shared future, or no future;UNESCO. Director-General, 1987-1999 (Mayor, F.)
111704;1998;111714;[38, 39, 40];Renewable energy: winds of change;Bequette, France
111704;1998;111715;[42, 43, 44];The Monastery of Haghpat;Baudourian, Elisabeth
111704;1998;111716;[45, 46];Dizzy Gillespie, a jazz giant;Leymarie, Isabelle
111704;1998;111717;[47, 48, 49];Interview with Marcel Marceau: the art of silence;Fargeon, Michel|Marceau, Marcel
112053;1998;112054;[4, 5, 6];An Institution on trial;Oliveira, Edmundo
112053;1998;112055;[6, 7];A Prisoner's testimony;Perego, Louis
112053;1998;112056;[8, 9];Waiting behind bars;Gue, Tina
112053;1998;112057;[10, 11, 12];Alternatives to jail;Cuesta Arzamendi, José Luis de la
112053;1998;112058;[13, 14];Invisible chains;Johansson, Linda
112053;1998;112059;[15, 16, 17];From revenge to reparation;Peters, Tony
112053;1998;112060;[18, 19];South Africa: puppets in prison;
112053;1998;112061;[20, 21, 22];Prisons for profit;Cavise, Leonard L.
112053;1998;112062;[23, 24, 25];Offenders' rights;Platek, Monika
112053;1998;112063;[28, 29];The Changing role of prison staff;Wazir, Abdel Azim
112053;1998;112064;[30];The Hard way back;Dia, Amadou Cissé
112053;1998;112065;[31, 32, 33, 34];Political prisoners;Zyl Smit, Dirk Van
112053;1998;112066;[38, 39];Fact file (prisons: a system in crisis);
112053;1998;112067;[40, 41];For a broader approach to education;UNESCO. Director-General, 1987-1999 (Mayor, F.)
112053;1998;112068;[42, 43, 44, 45];Water: will be there enough?;Bequette, France
112053;1998;112069;[46, 47];Colombian champeta;Leymarie, Isabelle
112053;1998;112070;[48, 49, 50];Interview with Susan Buirge;Maitra, Romain|Buirge, Susan
112488;1998;112490;[3, 4, 5, 6, 7, 8, 9, 10];Land-hungry in Brazil;Galano, Ana Maria
112488;1998;112491;[11];A Fresh outlook;UNESCO. Director-General, 1987-1999 (Mayor, F.)
112488;1998;112493;[12, 13, 14];Fanning the flames of greed;Bequette, France
112488;1998;112494;[14];Fears for a new millennium;Bou, S.
112488;1998;112495;[15, 16];Poison of the earth;Boukhari, Sophie
112488;1998;112496;[17, 18];Ending apartheid in education;Vally, Salim|Khouri-Dagher, Nadia
112488;1998;112497;[19, 20];A Second chance for success;Sopova, Jasmina
112488;1998;112498;[20];Hard times for teachers;Khouri-Dagher, Nadia
112488;1998;112499;[22, 23, 24, 25];The Sea and its treasures;Earle, Sylvia
112488;1998;112500;[26];Research: the state of the art;Bessis, Sophie
112488;1998;112501;[26];On course for co-operation;Bou, S.
112488;1998;112502;[27, 28];Climate's hidden engine;Gould, John
112488;1998;112503;[29, 30];The World beneath the waves;Van Dover, Cindy Lee
112488;1998;112504;[31, 32];Anyone for algae?;Boukhari, Sophie
112488;1998;112505;[33, 34];Harnessing ocean energy;Bequette, France
112488;1998;112506;[35];Offshore mineral resources;Bequette, France
112488;1998;112507;[36, 37];From fish scales...to sunken treasures;Otchet, Amy|Williams, Sue|Baumgartner, Tim
112488;1998;112508;[38, 39];Sea fever;André, Dominique
112488;1998;112509;[40, 41];Threats and conflicts;Wells, Sue|Shepherd, Gordon
112488;1998;112510;[42];Peace for the high seas;Borgese, Elisabeth Mann
112488;1998;112512;[43];A Strategic sea;Vaner, Semih
112488;1998;112513;[44, 45, 46];The Cod collapse;Anderssen, Erin
112488;1998;112514;[47, 48];Marine blues;Boukhari, Sophie
112488;1998;112515;[49];Trouble in paradise;Pattullo, Polly
112488;1998;112516;[50, 51];The Offshore islanders;Otchet, Amy
112488;1998;112517;[52, 53, 54, 55];Laws for the ocean;Townsend-Gault, Ian|Djalal, Hasjim
112488;1998;112518;[56, 57];The Unpunished polluter;Parmentier, Rémi
112488;1998;112519;[56];Sea tribunal makes a slow start;Oumarou, Seydou Amadou
112488;1998;112526;[57];An Action plan for the Med;Hoballah, Arab
112488;1998;112527;[58];Senegal-Guinea Bissau: agreeing to share;Oumarou, Seydou Amadou
112488;1998;112528;[58, 59];The Year of the Ocean;Ortiz de Urbina, Araceli
112488;1998;112530;[59];Morocco-European Union: co-operation in choppy waters;Amrani, Bahia
112488;1998;112531;[60, 61];Galley slaves;Bequette, France
112488;1998;112532;[62, 63];Where the spirits roam;Magannon, Esteban T.
112488;1998;112533;[64, 65, 66];When women are the spoils of war;Oosterveld, Valerie
112488;1998;112534;[65];Life must go on;Bou, S.
112488;1998;112535;[66, 67, 68];Aids: prevention or care;Bessis, Sophie|Simon, Xavier
112488;1998;112536;[68];Children behind bars;Oumarou, Seydou Amadou
112488;1998;112537;[69, 70];A Publishing revolution;Yakubovich, Maria
112488;1998;112538;[70];Togouna week in Djenné;Kiabou, Bamba
112488;1998;112539;[71, 72, 73];Lalibela's fragile churches;Boukhari, Sophie
112488;1998;112540;[74, 75];Satellites for the South;Boukhari, Sophie
112488;1998;112541;[75];Noah Samara: a businessman with the missionary spirit;Bou, S.
112488;1998;112542;[76, 77];Fiat Linux;Boukhari, Sophie
112488;1998;112543;[78, 79, 80, 81, 82];Youssou N'Dour: Africa's world musician;Boukhari, Sophie|Oumarou, Seydou Amadou
112488;1998;112706;[61];Treasure hunters beware;Williams, Sue
113355;1998;113356;[3, 4, 5, 6, 7, 8];Hopes and dreams of Algeria's youth;Taleb, Dalila
113355;1998;113357;[9];Progress for whom?;UNESCO. Director-General, 1987-1999 (Mayor, F.)
113355;1998;113358;[10, 11, 12, 13];Mutants on the menu;Bequette, France
113355;1998;113359;[14, 15, 16];Colombia's community mothers;Tournemire, Antoine de
113355;1998;113360;[15];Fighting for recognition;Suremain, Marie Dominique de
113355;1998;113361;[18, 19, 20];Shaking the ivory tower;Scott, Peter
113355;1998;113362;[21];Four pillars of wisdom;Neave, Guy R.
113355;1998;113363;[22, 23];What do students want? Germany: lost illusions;McCathie, Andrew
113355;1998;113364;[22, 23];What do students want? Indonesia: an uncertain future;Sukarsono, Achmad N.
113355;1998;113366;[24, 25, 26, 27];Wanted: a new deal for the universities;Escotet, Miguel Angel
113355;1998;113367;[26, 27];Vision and action for the next century;Ortiz de Urbina, Araceli
113355;1998;113368;[28, 29];Turkey: a course for the future;Arat, Necla|Güçlü, Abbas
113355;1998;113369;[30];Bulgaria's overdose of Russian profs;Ugarchinska, Rumiana
113355;1998;113370;[31, 32, 33];Graduates for hire;Boukhari, Sophie
113355;1998;113371;[33, 34];The Talent spotters;Lesseur, Jany
113355;1998;113372;[34, 35];India's loss, West's gain;Anbarasan, Ethirajan
113355;1998;113373;[36];Full heads but empty pockets;Amrani, Bahia
113355;1998;113374;[37];Tomorrow's world elite: interview with Jacques Attali;Attali, Jacques|Bessis, Sophie
113355;1998;113375;[38, 39, 40];The Web, the spider and the fly;Oumarou, Seydou Amadou|Lefort, René
113355;1998;113376;[41, 42, 43];Bilbao: the Guggenheim effect;Iglesias Kuntz, Lucía
113355;1998;113377;[44, 45, 46];Cybersnoopers on the prowl;Boukhari, Sophie
113355;1998;113378;[47, 48, 49, 50];Interview with Jeremy Rifkin: fears of a brave new world;Rifkin, Jeremy|Otchet, Amy
113615;1998;113616;[3, 4, 5, 6, 7, 8];Kabul: women in the shadows;Drévillon, Elizabeth
113615;1998;113617;[9];A Universal responsibility;UNESCO. Director-General, 1987-1999 (Mayor, F.)
113615;1998;113618;[10, 11, 12, 13];The Greenhouse gas trade;Agarwal, Anil|Narain, Sunita
113615;1998;113619;[12, 13];Pollution on the cheap;Boukhari, Sophie
113615;1998;113620;[14, 15, 16];www.$$$@online.education;Otchet, Amy
113615;1998;113621;[18, 19, 20];A Long march;Soberón, Francisco
113615;1998;113622;[21, 22];For an end to double standards;Bonino, Emma
113615;1998;113623;[23];Televised genocide;Brauman, Rony
113615;1998;113624;[24, 25, 26, 27];Globalization: what is at stake?;Campbell, Bonnie
113615;1998;113625;[27];Pandora's box;Bessis, Sophie
113615;1998;113626;[28];Poor relations;Abadie, Emmanuel
113615;1998;113627;[29, 30, 31];A Decisive victory;Pace, William R.|Anbarasan, Ethirajan
113615;1998;113628;[31, 32];The Struggle goes global;Boukhari, Sophie
113615;1998;113629;[33];South Korea: working women demand their due;Lesseur, Jany
113615;1998;113630;[34];To live with dignity in the United Kingdom;Lesseur, Jany
113615;1998;113631;[35];Mission accomplished;Williams, Jody
113615;1998;113632;[36];Keeping up with science;Caulfield, Timothy
113615;1998;113633;[37, 38, 39];Drugs: surveillance or punishment?;Bordes, Philippe
113615;1998;113634;[40, 41, 42];Culturally correct;Dudoignon, Stéphane A.
113615;1998;113635;[43, 44];Today's headlines, tomorrow's world;Boukhari, Sophie
113615;1998;113637;[44, 45];When the kitchen does the cooking;Boren, Sari M.
113615;1998;113638;[46, 47, 48, 49];Manuel Vázquez Montalbán: writing is an act of free choice;Iglesias Kuntz, Lucía
114138;1998;114139;[3, 4, 5, 6, 7, 8];Russia's angry miners;Shihab, Sophie
114138;1998;114140;[9];Imagining and building the 21st century;UNESCO. Director-General, 1987-1999 (Mayor, F.)
114138;1998;114141;[10, 11];Nuclear watch in the Far North;Anbarasan, Ethirajan
114138;1998;114142;[12, 13];The River's revenge;Xiong Lei
114138;1998;114143;[14, 15, 16];Under the scorching sun;Rharade, Abdelhag
114138;1998;114144;[16];A Two speed reform;Rharade, Abdelhag
114138;1998;114145;[18, 19, 20];Myths and realities;Papademetriou, Demetrios G.
114138;1998;114146;[20, 21, 22];World migration flows;
114138;1998;114147;[23, 24, 25];Who goes where?;Simon, Gildas
114138;1998;114148;[26, 27];Eternal scapegoats;Cruz, Antonio
114138;1998;114149;[28, 29];Last train to El Dorado?;Haffajee, Ferial
114138;1998;114150;[30, 31];The Italian exception;Forti, Marina
114138;1998;114151;[31, 32];¡Buenos días California!;Pachon, Harry P.
114138;1998;114152;[33];The Threatened dream;Smith, Robin
114138;1998;114153;[34, 35, 36];Immigration policy in a global economy;Sassen, Saskia
114138;1998;114154;[37, 38, 39];Small arms, many hands;Otchet, Amy
114138;1998;114155;[40, 41, 42];Africa's video alternative;Balogun, Ola
114138;1998;114156;[42];An Inventive response;Balogun, Ola
114138;1998;114157;[43, 44, 45];Crossed wires in global telecoms;Deane, James
114138;1998;114158;[46, 47, 48, 49];Mira Nair: an eye for paradox;Anbarasan, Ethirajan|Otchet, Amy
114252;1998;114255;[3, 4, 5, 6, 7, 8];Peace in Mozambique: the question and the people;Patraquim, Luis Carlos
114252;1998;114256;[9];War on drugs;UNESCO. Director-General, 1987-1999 (Mayor, F.)
114252;1998;114257;[10, 11];Pollution for export?;Jones, Tom|McNally, Richard
114252;1998;114258;[14, 15, 16];Sugarcoating empowerment;Khalil, Ashraf
114252;1998;114259;[18, 19, 20];A Weightless economy;Quah, Danny T.
114252;1998;114260;[21];The Emperor's new clothes;Boukhari, Sophie
114252;1998;114261;[22, 23];Skyrocketing into the intangible;
114252;1998;114262;[24, 25, 26];Inclusion or exclusion?;Primo Brago, Carlos Alberto
114252;1998;114263;[26, 27, 28];Managing velocity;Magretta, Joan
114252;1998;114264;[28, 29];The Indian Ocean's digital tiger;Poché, Jean Marc
114252;1998;114265;[29, 30];Tight margins in Sri Lanka;Varma, K.J.M.
114252;1998;114266;[30, 31];Viet Nam: diving in at the deep end;Martini, Philippe
114252;1998;114267;[31, 32];A Philosophy on four wheels;Lefort, René
114252;1998;114268;[32];Brazil: a three-tier system;Satomi, Lilian
114252;1998;114269;[33];The Art of advertising;Boukhari, Sophie|Toscani, Oliviero
114252;1998;114270;[34, 35, 36];The Future of work;Goldfinger, Charles
114252;1998;114271;[37, 38, 39];Should prostitution be legal?;Otchet, Amy
114252;1998;114272;[40, 41, 42];All hands on stage!;Nori, Ratnamala|Anbarasan, Ethirajan
114252;1998;114273;[43, 44, 45];Anatomy of the cybernaut;Boukhari, Sophie
114252;1998;114274;[46, 47, 48, 49];Gloria Cuartas: Colombia's messenger of peace;Ortiz de Urbina, A.|Iglesias Kuntz, Lucía
114699;1999;114700;[3, 4, 5, 6, 7, 8];Shanghai reborn;Chen Danyan
114699;1999;114701;[9];A Time for hope;UNESCO. Director-General, 1987-1999 (Mayor, F.)
114699;1999;114702;[10, 11, 12, 13];Soils in torment;Boukhari, Sophie
114699;1999;114703;[14, 15, 16];Building blocks of learning;Heldgaard, Jesper
114699;1999;114704;[18, 19, 20];The Longevity revolution;Butler, Robert
114699;1999;114705;[21, 22];Aging Chinese face a welfare gap;Huang Yan
114699;1999;114706;[22];Finland's youthful oldies;Anbarasan, Ethirajan
114699;1999;114707;[23, 24];Hard choices for the Third World;Apt, Nana
114699;1999;114708;[24, 25];Indian elders with nowhere to go;
114699;1999;114709;[25];Helping the elderly help themselves;
114699;1999;114710;[26];Lebanon: there's no place like home;Donati, Carole
114699;1999;114711;[27];Argentina's penniless pensioners;Göttling, Jorge
114699;1999;114712;[28, 29];Sage or spoilsport?;Puijalon, Bernadette|Trincaz, Jacqueline
114699;1999;114713;[30];Let the good times roll;Otchet, Amy
114699;1999;114714;[31, 32];African youth makes a takeover bid;Bop, Codou
114699;1999;114715;[32, 33];When are we leaving?;Malkin, Roy
114699;1999;114716;[34, 35];Old age's new horizons;
114699;1999;114717;[36];The Stoic way;Lynch, Enrique
114699;1999;114718;[37, 38, 39];Debt relief: a creditable solution?;Travis, Angela
114699;1999;114719;[40, 41, 42];Museums hoist their new colours;Rivard, René
114699;1999;114720;[43, 44];Can papers net a profit?;Lesseur, Jany
114699;1999;114721;[45];Writers bloc to defend their rights;Anbarasan, Ethirajan
114699;1999;114722;[46, 47, 48, 49, 50];Yordan Radichkov: the improbable Bulgarian;Sopova, Jasmina|Naulleau, Eric
114969;1999;114970;[3, 4, 5, 6, 7, 8];Bihar's lawless ways;Das, Arvind N.
114969;1999;114971;[9];Daring, caring and sharing;UNESCO. Director-General, 1987-1999 (Mayor, F.)
114969;1999;114972;[10, 11, 12];The Zero option for waste;Bequette, France
114969;1999;114973;[13];Farms in the city;Bequette, France
114969;1999;114974;[14, 15];Europe's welfare-to-work business;Wilson, Simon|Jeantet, Thierry
114969;1999;114975;[15, 16];Spanish youth outside in;Ballesteros, Cecilia
114969;1999;114976;[18, 19, 20];A Rare and precious resource;Sadeq, Houria Tazi
114969;1999;114977;[21];A Thirsty planet;
114969;1999;114978;[22, 23, 24];Who pays the piper? Who calls the tune?;Green, Colin|Briscoe, John|Barraqué, Bernard
114969;1999;114981;[25];Hungary: under new management;Szabo, Gabor
114969;1999;114982;[26];South Africa: water for everyone;Haffajee, Ferial
114969;1999;114983;[27];Mexico: the sweet smell of success;Núñez, Juan Carlos
114969;1999;114984;[28];India: Calcutta plugs its deficit;Bandyopadhyay, Tirthankar
114969;1999;114985;[29, 30, 31];A Convenient solution;Allan, J.A.
114969;1999;114986;[31, 32];An Economic mirage?;Otchet, Amy
114969;1999;114987;[33, 34, 35, 36];Custom-built solutions for international disputes;Dellapenna, Joseph W.
114969;1999;114988;[37, 38, 39];Adoption: for love or money?;Jacot, Martine
114969;1999;114989;[40, 41, 42];Children's books come of age;Iglesias Kuntz, Lucía
114969;1999;114990;[43, 44];The Press takes to the street;Boukhari, Sophie
114969;1999;114991;[44];Montreal's netizen news-vendors;Pélouas, Anne
114969;1999;114992;[45];Munich's street magazine;Sander, Kathrin
114969;1999;114993;[46, 47, 48, 49, 50];James Tobin: reining in the markets;Boukhari, Sophie|Anbarasan, Ethirajan|Kohut, John
115117;1999;115118;[3, 4, 5, 6, 7, 8];United States: rallying to a new beat;
115117;1999;115119;[9];Myths and illusions;UNESCO. Director-General, 1987-1999 (Mayor, F.)
115117;1999;115120;[10, 11, 12, 13];Nuclear decommissioning: a problem that won't go away;Lenssen, Nicholas
115117;1999;115121;[14, 15, 16];Chicanos paint their way back;Treguer, Annick
115117;1999;115122;[17, 18, 19];A New deal for the poor;Kohut, John|Bran, Mirel|Harsono, Andreas|Lionet, Christian|Zinga, Valentin Simeon
115117;1999;115123;[20, 21, 22];The Final and optimal crisis of the century;Ricupero, Rubens
115117;1999;115124;[23, 24];The Markets: a fickle friend;Harsono, Andreas
115117;1999;115125;[25];Mali: growth without development;Boukhari, Sophie
115117;1999;115126;[27, 28];USA: the self help gospel;Elliott, Vicky
115117;1999;115127;[28, 29, 30];Twilight in Tunisia;Boukhari, Sophie
115117;1999;115128;[30, 31];In the former Eastern bloc, a hazardous transition;Noman, Omar
115117;1999;115129;[32, 33];Culture: the wild card;Singh, Ramesh
115117;1999;115130;[34];ATD's streetwise librarians;Jacot, Martine
115117;1999;115131;[35];Madagascar: a waning tradition;Rangers, Soahangy Mamisoa
115117;1999;115132;[36];Another lost decade?;Lemaresquier, Thierry|Keklik, Mümtaz
115117;1999;115133;[37, 38, 39];Genetic weapons: a 21st-century nightmare?;Anbarasan, Ethirajan
115117;1999;115134;[40, 41, 42];Tracking down looted art;Iglesias Kuntz, Lucía
115117;1999;115135;[43, 44, 45];ONE intelligent island;Rajendran, Malini
115117;1999;115136;[46, 47, 48, 49];Ahmadou Kourouma: an African novelist's inside story;Lefort, René|Rosi, Mauro
115117;1999;115137;[26];Chile's two-track therapy;Olivares, Eduardo
115591;1999;115592;[3, 4, 5, 6, 7, 8];Ayacucho: an uneasy calm;Díez-Canseco Távara, Francisco
115591;1999;115593;[9];Peace without victory;UNESCO. Director-General, 1987-1999 (Mayor, F.)
115591;1999;115594;[10, 11];Indigenous peoples take on big business;Boukhari, Sophie
115591;1999;115595;[12, 13];The Oil flows, and the forest bleeds;Viteri Gualinga, Carlos
115591;1999;115596;[13];The Kakadu controversy;Schulz, Dennis
115591;1999;115597;[14, 15, 16];Pretending for real;López, Asbel
115591;1999;115598;[18, 19];What's in a game?;Lefort, René|Harvey, Jean
115591;1999;115599;[20, 21];Iranian women put on their running shoes;Ghazi, Siavosh
115591;1999;115600;[22];Training for life;Bjellaanes, Ole Kristian
115591;1999;115601;[23];Going for glory;Manarin, Glenn|Myung-soo Kim Taejon
115591;1999;115602;[24];A Star that never rose;Man Jusu, K.K.
115591;1999;115603;[25, 26];Basketball at midnight;Sailes, Gary A.
115591;1999;115604;[26, 27, 28];Hidden hurdles of colour;Otchet, Amy
115591;1999;115605;[28, 29, 30];The Agony and the ecstasy;Liotard, Philippe
115591;1999;115606;[30, 31];Batting for the nation;Guha, Ramachandra
115591;1999;115607;[32];A Cuban mix of muscle and ideology;Bustillo, Marcos
115591;1999;115608;[33];New players, same game;Allison, Lincoln
115591;1999;115609;[34];All together!;Lopes, Sergio Leite
115591;1999;115610;[35];Till death do us part;Arias, Eduardo
115591;1999;115611;[36];May the betting man win...;Horn, Robert|Khaikaew, Thaskina
115591;1999;115612;[37, 38, 39];No farewell to arms;Fisas, Vincenç
115591;1999;115613;[40, 41, 42];Alexandria, from papyrus to the Internet;Arseneault, Michel
115591;1999;115614;[43, 44, 45];Latin America's endangered frequencies;Roncagliolo, Rafael
115591;1999;115615;[46, 47, 48, 49, 50];Leila Shahid: the resolve of a Palestinian envoy;Boukhari, Sophie|Otchet, Amy
115858;1999;115859;[9];Science to what purpose?;UNESCO. Director-General, 1987-1999 (Mayor, F.)
115858;1999;115860;[10, 11, 12, 13];Antarctica's tainted horizons;Anbarasan, Ethirajan|Walton, David
115858;1999;115861;[14, 15, 16];Schools for eco-citizens;Guttman, Cynthia
115858;1999;115862;[17, 18, 19];Who owns science?;Waast, Roland|Boukhari, Sophie
115858;1999;115864;[20, 21];A German chemist's double life;Ronzheimer, Manfred
115858;1999;115865;[20, 21, 22];The Science-tech convergence;Branscomb, Lewis M.
115858;1999;115866;[23];The Symbiosis of pure and applied science;Brooks, Harvey
115858;1999;115867;[24];Staying ahead of the pack;Byé, Pascal
115858;1999;115868;[25, 26];Open house or closed shop?;Dickson, David
115858;1999;115869;[27];The Big three get together;Boukhari, Sophie
115858;1999;115870;[28, 29];A Global snapshot of scientific trends;Braun, Tibor|Glänzel, Wolfgang|Schubert, András
115858;1999;115871;[30];All eyes on El Niño;Coles, Peter
115858;1999;115872;[31];Former USSR: halting the brain drain;Sopova, Jasmina
115858;1999;115873;[32, 33];China: a market-minded contender;Plafker, Ted
115858;1999;115874;[33];Latin America: a tough transition;Vessuri, Hebe
115858;1999;115875;[34];Brazil: a bridgehead to the tropics;Iglesias Kuntz, Lucía
115858;1999;115876;[35, 36];Science for citizens;Krishna, V.V.
115858;1999;115877;[37, 38];Child labour: a lesser evil?;Boukhari, Sophie
115858;1999;115878;[39];Peru's child workers stake their claims;Cisneros, Luis Jaime
115858;1999;115879;[40, 41];Mali's direct democracy;Lerner, Dietlind
115858;1999;115880;[42];In the shade of the palaver tree;Sopova, Jasmina
115858;1999;115881;[43, 44, 45];Soaps with a Latin scent;Ortiz de Urbina, Araceli|López, Asbel
115858;1999;115882;[46, 47, 48, 49, 50];Mark Thomas: method and madness of a TV comic;Otchet, Amy
115858;1999;115883;[3, 4, 5, 6, 7, 8];Nostalgia for Istanbul;Gürsel, Nedim
116241;1999;116243;[3, 4, 5, 6, 7, 8];Madagascar's undaunted street children;Razafy, Adelson
116241;1999;116244;[9];Cities, citizens, and civilization;UNESCO. Director-General, 1987-1999 (Mayor, F.)
116241;1999;116245;[10, 11, 12, 13];Space law lifts off for a new odyssey;Otchet, Amy
116241;1999;116246;[14, 15, 16];Colombia exports its new school blueprint;López, Asbel
116241;1999;116247;[16];Guatemala: motivation and multispeed learning;Valdés, Mirja
116241;1999;116248;[18, 19];Living with Leviathan;Jacot, Martine
116241;1999;116249;[20, 21];The Urban explosion;
116241;1999;116250;[22, 23, 24, 25];Lagos: the survival of the determined;Otchet, Amy
116241;1999;116251;[24, 25];Fear and loathing in Ikosi;Otchet, Amy
116241;1999;116252;[26, 27, 28];Jakarta's dispossessed;Harsono, Andreas
116241;1999;116253;[29, 30, 31];A Brasilian's home is a castle;Valladares, Licia|Jacot, Martine
116241;1999;116255;[32, 33, 34, 35];Shanghai's migrant millions;Irwin, James
116241;1999;116256;[36];Urbanization and globalization;Wilheim, Jorge
116241;1999;116257;[37, 38, 39];Dead-end seeds yield a harvest of revolt;Anbarasan, Ethirajan
116241;1999;116258;[40, 41, 42];Cracking the code of art's allure;Freeman, Anthony
116241;1999;116259;[43, 44];A Virtual library on the Web;Boukhari, Sophie
116241;1999;116260;[45];2,000 world classics on line;Weller, Sam T.
116241;1999;116261;[46, 47, 48, 49, 50];Gurdev Singh Khush: masterminding a new rice revolution;Anbarasan, Ethirajan
116578;1999;116579;[3, 4, 5, 6, 7, 8, 9, 10];Dancing with the rivers;Saussier, Gilles
116578;1999;116580;[12, 13, 14];The Silent casualties of war;Richards, Paul|Sperling, Louise
116578;1999;116581;[15, 16];Colombia: the seeds of return;Reyes, Leticia
116578;1999;116582;[17, 18, 19, 20];Asia takes a crash course in educational reform;Pennington, Matthew
116578;1999;116583;[22, 23];Is cultural tourism on the right track?;Robinson, Mike
116578;1999;116584;[24, 25];The Pioneers;Malkin, Roy
116578;1999;116585;[26, 27];The Globalization of tourism;
116578;1999;116586;[28, 29];The Himalayas: masked dances and mixed blessings;Shackley, Myra
116578;1999;116587;[30, 31];Masters in their own tepees;Marchant, Garry
116578;1999;116588;[32, 33];Ecotourism without tears;Blangy, Sylvie
116578;1999;116589;[34];Peru's meet the people tours;Gonzáles de Remoué, Leticia
116578;1999;116590;[35, 36];Will market forces rule?;Patin, Valéry
116578;1999;116591;[37];Pompeii puts its house in order;Jacot, Martine
116578;1999;116592;[38, 39];Learning holidays: a thumbnail guide;Marchant, Garry
116578;1999;116593;[40, 41, 42];Petra's new invaders;Ayad, Christophe
116578;1999;116594;[42, 43];Venice: coping with culture vultures;Russo, Antonio Paolo
116578;1999;116595;[44, 45, 46];Luang Prabang: a ghost town returns to life;Engelmann, Francis
116578;1999;116596;[47, 48];A Slow rescue for Morocco's earthen citadels;Berriane, Mohamed
116578;1999;116597;[49, 50];Central Europe: castles gear up for business;Guttman, Cynthia
116578;1999;116598;[51, 52];The Right road for Compostela;Iglesias Kuntz, Lucía
116578;1999;116599;[53];An Empire built on the sands;Otchet, Amy
116578;1999;116600;[54, 55];Philosophy of a guidebook guru;Wheeler, Tony
116578;1999;116602;[56];Towards an ethics of tourism;Guttman, Cynthia
116578;1999;116603;[57, 58, 59];Humanitarian intervention: a controversial right;Corten, Olivier
116578;1999;116604;[59, 60];The First lessons of Kosovo;Corten, Olivier|Bettati, Mario
116578;1999;116605;[61, 62, 63, 64];War comics: the new realism;Altarriba Ordoñez, Antonio
116578;1999;116606;[65, 66, 67, 68];Morse: the end of an era?;Smith, Tony
116578;1999;116607;[69, 70, 71, 72, 73, 74];Oswaldo de Rivero: debunking the myths of development;Ortiz de Urbina, Araceli|Iglesias Kuntz, Lucía
116578;1999;116609;[16];Somalia's bitter harvest;Kiambi, Dan
117043;1999;117044;[3, 4, 5, 6, 7, 8];Forever twenty in Cuba;Ponte, Antonio José
117043;1999;117045;[9];A Crucial encounter;UNESCO. Director-General, 1987-1999 (Mayor, F.)
117043;1999;117046;[10, 11, 12, 13];Millennium bugs with a deadly bite;Matthews, Robert
117043;1999;117047;[14, 15, 16];Schooling in times of strife;Richmond, Mark
