Colonne1;year;record_number;pages;catalogue_title;authors
78246;1969;58458;[22, 23, 24, 25];The Spread of Buddhist culture;Silva, Anil de
78246;1969;58461;[25, 26, 27, 28];The Challenge of the spaceship;Clarke, Arthur C.
78246;1969;58683;[28, 29];My first steps in space;Leonov, Aleksei Arkhipovich
78246;1969;58684;[31, 32, 33];Vernacular languages in changing Africa;Diagne, Pathé
78246;1969;58688;[33, 34, 35];The Pollution of the ocean;Gorsky, Nicolai
78246;1969;58690;[36, 37];700 million forgotten minds;UNESCO. Director-General, 1962-1974 (Maheu, R.)
78246;1969;58691;[38];Avicenna;Aboussouan, Camille
78246;1969;58694;[43, 44, 46];Nuclear weapons and world sanity;Pauling, Linus
78246;1969;58695;[46, 47];Of ants and men;Gray, James
78246;1969;58696;[48, 49];Canaletto's paintings helped rebuild shattered Warsaw;Hryniewiecki, Jerzy
78246;1969;58711;[49, 50, 51];Pictures in our heads;Klineberg, Otto
78246;1969;58714;[54, 55];In the centre of the map;Hodgson, Marshall G.S.
78246;1969;58716;[56, 57, 78];The New science of art conservation;Plenderleith, Harold J.
78246;1969;58719;[58, 59];The World's growing water shortage;Batisse, Michel
78246;1969;58722;[61, 62, 63];Rousseau, father of anthropology;Lévi-Strauss, Claude
78246;1969;58727;[66, 67];The Rediscovery of Africa;Davidson, Basil
78246;1969;58728;[69];The Forbidden dialogue;Nkosi, Lewis
78246;1969;58729;[70];The Camel, facts and fables;Schmidt-Nielsen, Bodil|Schmidt-Nielsen, Knut
78246;1969;58730;[71, 72, 73];The Royal highway of the Incas;Carrera Andrade, Jorge
78246;1969;58731;[73, 74, 76];Don Quixote of the radio;Behrman, Daniel
78246;1969;58732;[76, 77];Peking Man in the apothecary's shop;Koenigswald, G.H.R. von
58738;1969;58737;[4, 5, 6, 7, 8, 9, 10, 11, 12, 13];Erasmus, universal thinker of yesterday for today;Margolin, Jean Claude
58738;1969;58739;[22, 23, 24, 25, 26, 27, 28];"New light on the emergence of civilization in the Near East; revelations of the 5,000 year old city of Chogha Mish, Iran";Kantor, Helène J.|Delougaz, Pinhas P.
58738;1969;58740;[28, 29, 30];"Men die earlier than women; considerations of a Soviet demographer";Urlanis, Boris Tsezarevich
78290;1969;58744;[4, 5, 6, 7, 8, 9, 10, 11, 12, 13, 14, 15, 16, 17, 18, 19, 20, 21, 22, 23, 24, 25, 26, 27, 28, 29, 30, 31];Cymatics: the sculpture of vibrations;Jenny, Hans
78290;1969;58745;[32, 33, 34, 41];Quasars and the birth of the universe;Marx, György
78290;1969;58747;[35, 36, 37, 38, 39, 40, 41];The Weaving of an engineering masterpiece: a spider's orb web, a step-by-step analysis by a structural engineer of the extraordinary way a spider builds its web;Dugdale, Bert E.
78234;1968;58758;[4, 5, 6];How the Charter on Human Rights was born;Cassin, René
78234;1968;58760;[7, 8, 9, 10, 11, 12, 13];30 questions on human rights;United Nations
78234;1968;58761;[14];UNESCO and human rights;
78234;1968;58762;[15, 16, 20, 21, 31, 32];Only the educated are free';François, Louis
78234;1968;58763;[22, 23, 24, 25];The Ubiquitous shadow of racism;Rex, John
78234;1968;58764;[26, 27, 28, 29, 30];The New frontiers of international law;MacBride, Seán
74679;1984;58766;[4];Where do we stand in the war on hunger?;
74679;1984;58767;[5, 6, 7, 8];Food for a hungry world;Dakouré, K. Antoine
74679;1984;58768;[9, 10, 11];"Ill fares the land; have we reached the end of a growth era in world food output?";Brown, Lester Russell|Worldwatch Institute
74679;1984;58769;[12, 13];Children in peril;Ramalingaswami, V.
74679;1984;58770;[14, 15];Malnutrition's tragic toll;
74679;1984;58771;[16, 17, 18, 19];"Food first; a down-to-earth approach to nutrition and rural development";Lunven, Paul
74679;1984;58772;[20, 21];Africa: the hunger belt;Food and Agriculture Organization of the United Nations
74679;1984;58773;[22, 23, 24];Seeds of plenty: the promise of biotechnology;Ovchinnikov, Yuri
74679;1984;58775;[25, 26, 27, 28, 29];"Interdependence; 'Nationalism provides too narrow a focus for overcoming poverty and hunger'";Steidl-Meier, Paul
74679;1984;58776;[29, 30, 31];UNESCO and nutrition education;Van der Vynckt, Susan
74679;1984;58777;[32, 33, 34];War, hunger, poverty;Echeverria, Luis
78373;1968;58794;[4, 5, 6, 7, 8, 9, 10];Science and the culture of our times;Gould, Laurence M.
78373;1968;58795;[10, 11, 12, 13, 14];Lilacs in the cosmos;Kassil, Lev Abramovitch
78373;1968;58796;[15, 16];Science and fundamental concepts of thinking;Couderc, Paul
78373;1968;58797;[17, 18, 19, 20, 21, 22, 23, 32];UNESCO mathematical model to harness the Mekong;Ellis, W.J.
78373;1968;58798;[24, 25, 26, 27, 28, 29];Communication satellites: the new music of the spheres;Schramm, Wilbur
78373;1968;58799;[30, 31];The World we hope for: a prize-winning essay from Uruguay;Costa Diaz, Maria Cristina
58803;1968;58804;[4, 5, 6, 7, 8, 9, 10, 11, 12, 13];Facing the 21st century;Gindertael, Jean Michel van
58803;1968;58813;[14];Wanted: 3.5 million doctors;Kavka, Stanislav
58803;1968;58814;[15, 16, 17, 29];The Click of computerized medicine;Anderson, John
58803;1968;58815;[20, 21, 22, 23, 24, 25, 26, 27, 28, 29];"Medical experiments on man; round-table on the doctor's dilemma";Florkin, Marcel
78237;1968;58944;[4, 5, 6, 7, 8];Outside the written word;Valderrama Martínez, Fernando
78237;1968;58945;[9, 10, 11, 12];A Down-to-earth approach to literacy;Deleon, Asher
78237;1968;58946;[13, 14, 15, 16];Literacy: the ABC of development;
78237;1968;58947;[17, 18, 19, 20, 21, 22];The Shorthand class that started an avalanche;Salis, Francesco|Attinelli, Lucio
78237;1968;58948;[23, 24, 25];A Talk with Princess Ashraf of Iran;
78237;1968;58949;[26, 27, 28, 29, 30, 31];Our only realistic hope of eradicating illiteracy';Jeffries, Charles
78237;1968;58950;[32];International Year for Human Rights: message from René Maheu, Director-General of UNESCO;UNESCO. Director-General, 1962-1974 (Maheu, R.)
58953;1968;58954;[6, 7, 8];The International control of narcotics;Kusevic, Vladimir
58953;1968;58955;[8, 9, 10, 11, 12];From opium to LSD: the long history of drugs;Granier-Doyeux, Marcel
58953;1968;58956;[13, 14, 15, 16, 17];Mind-altering drugs: a scientific appraisal;Blum, Richard H.
58953;1968;58958;[18, 19, 20];LSD: new menace to youth;Evang, Karl
58953;1968;58959;[20, 21, 22, 23];The Vogue of the pill (tranquillizers, that is);Avroutski, Grigory
58953;1968;58960;[24, 25, 26, 27, 28, 29, 32];Interpol versus the underworld of narcotics;Nepote, Jean
58953;1968;58962;[30, 31, 32];Statement on Race and Racial Prejudice;
78431;1968;58968;[4, 5, 6, 7, 8, 9, 10, 11];Saving our heritage in stone: a world-wide challenge;Daifuku, Hiroshi
78431;1968;58969;[12, 13, 14, 15];A Bold plan for cultural tourism in Brazil;Parent, Michel
78431;1968;58973;[16, 17, 18, 34];The Parthenon in peril;Dontas, Georges
78431;1968;58976;[22, 23, 24, 25, 26, 27];Borobudur: the colossal Javanese sanctuary, the world's largest ensemble of Buddhist reliefs threatened by imminent destruction;Groslier, Bernard Philippe
78431;1968;58982;[28, 29, 30, 31, 32];Mammouth temples of southern India;
78431;1968;58983;[33];Mammoth temples of Guatemala;
78431;1968;58985;[35];Kazanluk: on looking into a Thracian tomb;
58803;1968;59032;[30, 31, 32];How's the world's health?;
78306;1968;59035;[4, 5, 6, 7];"The Taming of the atom for peace; the International Atomic Energy Agency";
78306;1968;59036;[8, 9, 10, 11, 12, 13, 14];Charting the nuclear labyrinth: a basic survey of the atom and its peaceful uses;Usmani, I.H.
78306;1968;59037;[14, 15, 16];Dream come true? A second Panama Canal thanks to nuclear explosives?;Schaerf, Carlo
78306;1968;59057;[17, 18, 44];Isotopes with 'kid gloves';White, Stanley
78306;1968;59058;[18, 19, 20, 21];Honeymooning in Capri, or, The tribulations of a fruit fly in the modern atomic age;Lindquist, Donald A.
78306;1968;59060;[22, 23, 24, 25, 26, 27, 28, 29, 30];Carbon 14: nuclear clock for archeology;Libby, Willard F.
78306;1968;59061;[30, 31, 32, 33, 34, 35, 36];Sophie and Bruno in the land of the atom;
78306;1968;59062;[37, 38, 39, 40, 41];The Twilight lives of man-made atoms;Flerov, Georgi Nicolaevich|Kuznetsov, Vladimir Ivanovich
78306;1968;59063;[42, 43, 44];Nuclear energy and our future;Seaborg, Glenn T.
78306;1968;59064;[45, 46, 48];The Nations harness the atom;
78306;1968;59065;[47];UNESCO should become the organization for youth;UNESCO. Director-General, 1962-1974 (Maheu, R.)
78240;1968;59094;[4, 5, 6, 7, 8];Emperor Meiji, father of modern Japan;Kimura, Ki
78240;1968;59097;[12, 13, 14];Yukichi Fukuzawa, master of enlightenment in the Meiji era, we copy a physics book in two days and nights;Fukuzawa, Yukichi
78240;1968;59102;[15, 16, 17, 18];The Great manifesto of Fukuzawa;
78240;1968;59105;[19, 20, 21, 22, 23, 24];The 'Secret' of Japan's educational triumph;Hiratsuka, Masunori
78240;1968;59107;[24, 25, 26, 27];From chrysanthemum to electronic computer;
78240;1968;59109;[28, 29, 30, 34, 43, 45, 46, 47, 48];Japan's contribution to Western literature and the arts;Miner, Earl
78240;1968;59217;[31];Nine writers of modern Japan;
78240;1968;59219;[49, 50, 51, 52, 53];"Tokyo; a tale of two cities";Robson, William Alexander
78240;1968;59222;[54, 55, 56, 57, 58, 59, 60, 61];Kenzo Tange and the megalopolis of tomorrow;Koffler, Sandy
78240;1968;59223;[62, 63, 64];Hokkaido, frontier land of the far north;
78240;1968;59224;[65, 66, 67];Unrest and promise of Japan's youth;
78240;1968;59225;[68, 69, 70, 71, 72];How Japan streamlined its written language;Hasegawa, Shin Ichi
74683;1984;59232;[4];Four centuries of growth and splendour;Niane, Djibril Tamsir
74683;1984;59234;[5, 6, 7];Ife-Benin: two kingdoms, one culture;Ryder, Alan
74683;1984;59235;[8, 9, 10];The Secrets of Zimbabwe;Fagan, Brian M.
74683;1984;59236;[11];Trade links from Europe to Cathay;
74683;1984;59237;[12, 13];West Africa's oldest metropolis;
74683;1984;59238;[14, 15, 16];The Colonial challenge;Boahen, Albert Adu
74683;1984;59239;[17, 18];The Scramble for territory;Uzoigwe, Godfrey N.
74683;1984;59240;[23, 24];An Unequal combat;Uzoigwe, Godfrey N.
74683;1984;59260;[25, 26];North Africa: the long struggle;Laroui, Abdallah
74683;1984;59261;[27, 28, 29];West Africa: the fight for survival;Guèye, Mbaye|Boahen, Albert Adu
74683;1984;59264;[30, 31];East Africa: diplomacy and defiance;Mwanzi, Henry A.
74683;1984;59269;[32, 33, 34, 35, 36, 37, 38];The Colonial heritage;Boahen, Albert Adu
59301;1968;59299;[6, 7, 8, 9, 10, 11, 12, 13, 14, 15, 16, 17, 18, 19, 20, 21, 22, 23, 24, 25, 26, 27, 28, 29, 30, 31];The Right to be a man;Hersch, Jeanne
78241;1968;59304;[4, 5, 6, 7, 8, 9];Still time to save Venice;Vrioni, Ali
78241;1968;59305;[10, 11, 12, 13, 14, 15, 16, 17, 18, 19];The Thousand paradoxes of Venice;
78241;1968;59307;[20, 21, 22, 23, 24, 25, 26, 27, 28, 29, 30, 31, 32, 33];The City of ten thousand masterpieces;Frédéric, Louis
78241;1968;59311;[34, 35, 36, 37, 38, 39, 56];Venice and the Venetians of tomorrow;
78241;1968;59312;[40, 41, 42, 43, 44, 45];Venice, link between Orient and Occident;Brion, Marcel
78241;1968;59314;[46, 47];"Philae; an appeal by the Director-General of UNESCO: November 6, 1968";UNESCO. Director-General, 1962-1974 (Maheu, R.)
78241;1968;59316;[48, 49, 50, 51, 52, 53, 54, 55];The Survival of Philae;Christophe, Louis A.
78222;1967;59339;[4, 5];For Florence and Venice: appeal launched on December 2, 1966 by René Maheu, Director-General of UNESCO, at the opening of the International Campaign for Florence and Venice;UNESCO. Director-General, 1962-1974 (Maheu, R.)
78222;1967;59437;[6, 7, 8, 9, 10, 11];Years to repair the damage;Molajoli, Bruno
78222;1967;59440;[12, 13];The Plight of the Florentine artisans;Keating, Rex
78222;1967;59442;[14, 15, 16, 17, 18, 19, 20, 21, 22, 23];Dimensions of a disaster;
78222;1967;59443;[24, 25, 26, 27, 28, 29, 34];The Painting hospital in the lemon grove;Plenderleith, Harold J.
78222;1967;59445;[35, 36, 37, 38];The Anatomy of the flood;Tonini, Dini
78222;1967;59449;[30, 31, 32, 33];Over a million waterlogged books and manuscripts;
78224;1967;59451;[4, 5, 6, 7, 8, 9];Three centuries of demography: John Graunt's offspring;Urlanis, Boris Tsezarevich
78224;1967;59459;[10, 11, 12, 13, 34];A Look at world population the day after tomorrow;Fourastié, Jean
78224;1967;59461;[14, 15];Hanging cities ahead?;
78224;1967;59462;[16, 17, 18, 19, 20, 21, 22];Operation anti-disaster;Mills, Edward D.
78224;1967;59660;[23, 24];"The Intruders; UNESCO's Director-General looks at ethics in the mass media";UNESCO. Director-General, 1962-1974 (Maheu, R.)
78224;1967;59661;[25, 26, 27];Rameses finds a new home;
78224;1967;59662;[28, 29, 30];UNESCO in the service of peace;Lipski, Vladimir de|UNESCO. General Conference 1966 14th session
78449;1967;59663;[4, 5, 6, 7, 8, 9, 10, 11, 12, 13];Apartheid in South Africa;
78449;1967;59665;[14, 15, 16, 17, 18, 19];The Price of segregation;Paton, Alan
78449;1967;59666;[20, 21, 22];The Forbidden dialogue;Nkosi, Lewis
78449;1967;59667;[23, 24];The Seeds of wrath;Brutus, Dennis
78449;1967;59668;[24, 25, 26];The Dying minds;Segal, Ronald
78449;1967;59672;[27, 28, 29];The Fettered spirit;Breytenbach, Breyten
78449;1967;59675;[30, 31];South Africa's wasted manpower;International Labour Organization
78449;1967;59678;[33, 34];Apartheid and the church;
59683;1967;59682;[4, 5, 6, 7, 8, 9, 30];A Culture in the making;James, F. Cyril
59683;1967;59684;[14, 15, 16, 31, 32, 33, 34, 35];Canada's far north, a land on the move;Baird, Irene
78231;1967;59693;[14, 15, 20];Facing the complexities of modern education;Prokofiev, Mikhail
59683;1967;59700;[18, 19, 20, 21, 22, 23];Thousands of stained-glass windows from medieval times;
59683;1967;59703;[24, 25, 26];"Laughter and endurance; well-springs of Czechoslovak literature";Hoffmeister, Adolf
59683;1967;59706;[27, 28, 29];Orphanage for wild animals;Greenough, Richard
59709;1967;59710;[6, 7];The Birth of wheat and maize farming;Hawkes, Jacquetta
59709;1967;59712;[7, 8];The Early domestication of animals;Hawkes, Jacquetta
59709;1967;59768;[9, 10, 11];When Orpheus struck the trembling lyre';Pareti, Luigi
59709;1967;59769;[11];Numerals open new mathematical horizons;Wolff, Philippe
59709;1967;59770;[12, 13];Did Japanese fishermen bring the art of pottery making to Ecuador 5,000 years ago?;Meggers, Betty L.
59709;1967;59771;[14, 15];The Dawn of the geographic spirit;Wolff, Philippe
59709;1967;59772;[16, 17];The Sailing vessel comes into its own;Gottschalk, Louis
59709;1967;59773;[20, 21, 22, 23, 24];The Second scientific revolution;Bronowski, Jacob
59709;1967;59774;[24, 25, 26];The Sinews of industrial society;Ware, Caroline F.|Panikkar, K.M.|Romein, Jan M.
59709;1967;59775;[27, 28, 29];The Era of synthetic materials;Ware, Caroline F.|Panikkar, K.M.|Romein, Jan M.
78367;1967;59813;[8, 9, 10, 11, 12];The Architects of silence;Stramentov, Constantin
74681;1984;59855;[7, 8, 9];"North Africa's great Roman road; from Alexandria to Gibraltar";Schneider, Eugenia Equini
78371;1967;60000;[18, 19, 20, 29, 31, 44, 45];The Epics in the art of South Asia;Goswamy, B.N.
78371;1967;60001;[36, 37, 38, 39, 40, 41, 42];The Kathakali and the dance-drama of India;Nair, C. Kunchu
78371;1967;60002;[43];India's ancient heroes on celluloid;Garga, Bhagwan D.
78208;1965;60300;[17, 18, 19, 20, 21, 22];Science and the common man, pt. 2;Calder, Ritchie
78208;1965;60301;[25, 26, 27];Geneva: world headquarters in the fight against smallpox;
78208;1965;60302;[28, 29, 30, 31];Edward Jenner, the father of vaccination;
78423;1965;60308;[4, 5, 6, 7];Biology looks at race;Debetz, Georghi F.
60487;1965;60433;[4, 5, 6, 7, 8, 9];Telecommunications: 1865-1965, a century of international cooperation;
78423;1965;60434;[12, 13, 14, 15];The Future of 'homo sapiens': a biologist's view;Hiernaux, Jean
78423;1965;60435;[16, 17, 18, 19];Johann Gregor Mendel;Rostand, Jean
78423;1965;60436;[20, 21, 22, 23, 24, 25, 26, 27, 28];Apartheid in South Africa;United Nations
78423;1965;60437;[29, 30, 31, 32, 33];It is still not too late...;United Nations
60487;1965;60453;[10, 11, 12, 13];From telephone to telly-phone: echoes from the astonishing world of telecommunications;
60487;1965;60474;[14, 15, 16, 17, 33];Engineers in the new India;Javoronkov, Vadim A.
60487;1965;60476;[18, 19, 20, 21, 22, 23];Caravaggio: the rehabilitation of a long-disdained genius;
60487;1965;60478;[24];The Ancient world;
60487;1965;60479;[25, 26, 27];Ancestors of the ball-point pen;Pareti, Luigi
60487;1965;60480;[28, 29];The Wooden Ox', the world's first wheelbarrow;Petech, Luciano
60487;1965;60486;[30, 31, 32, 33];The Birth of functional architecture: town planning and housing in ancient Rome;Frederiksen, M.W.
60488;1965;60489;[12, 13, 14, 15, 16, 17];The Great Asian highway;Ahmad, M.S.
60488;1965;60491;[18, 19, 20, 21];The Stones of Jaipur speak of astronomy;
60488;1965;60492;[22, 23, 24, 25, 26];Mohenjo-Daro: a 5,000-year old heritage menaced by destruction;Plenderleith, Harold J.|Beaufort, C.C. Theodoor de|Voûte, Caesar
60488;1965;60496;[27, 28, 29, 30, 31];City of the dead: the mystery of Mohenjo-daro;Brion, Marcel
60510;1965;60512;[8, 9, 10, 11, 12, 13, 14, 15, 16];An Explosion of vitality;François, Pierre
60510;1965;60514;[17, 18, 19, 20, 21];Operation 'community service';Barclay, Eduardo
60510;1965;60517;[22, 23, 24, 25];One winner, two victories: the first International Fair Play Trophy;
60510;1965;60520;[26, 27, 28, 29];In the grown-up world of teen-agers;
60510;1965;60521;[30, 31];Daring lifesavers of the surf;
60510;1965;60522;[32, 33, 34, 35, 36, 37, 38, 39];A Poetic world fashioned on the weaver's loom;Wassef, Rameses Wissa
60510;1965;60524;[40, 41, 42, 43, 44, 45, 46, 47];Science: thrills of exploration, excitement of discovery;Wattier, Francis L.
60510;1965;60527;[51, 52];More than 1,000 million under-25's;Deleon, Asher
60510;1965;60528;[52, 53, 68];One camp, three nations, many friends;Rose, Margaret
60510;1965;60541;[54, 55, 56];The Hospital that Jack and Jill built;
60510;1965;60542;[57, 58, 59];20,000 volunteer workers for progress and friendship;Gillette, Arthur Lavery
60510;1965;60544;[62, 63, 64, 65];A Generation of builders;Kotler, Yuri
60510;1965;60546;[66, 67];UNESCO and youth;
60619;1965;60621;[11, 12, 13, 14];Wanted: a new dialogue between authors and readers;Escarpit, Robert
60619;1965;60625;[15, 16];Two-thirds of world's books produced by twelve countries;
60619;1965;60627;[17];The Growth of the Hispanic book market;
60619;1965;60628;[18, 19, 20];Books printed with a camera;
60619;1965;60630;[21, 22];UNESCO and the world of books;Behrstock, Julian
60619;1965;60631;[23, 24, 25, 26, 27];The Dilemmas of publishing in South-East Asia;Prakash, Om
60619;1965;60633;[28, 29, 30, 31];"A Continent in quest of a publishing industry; a UNESCO survey in Africa";Fyle, Clifford Nelson
78210;1965;60634;[4, 5, 6, 7, 8, 9, 30, 31, 32, 33, 34];"Turning point; the United Nations Development Decade is 5 years old; how has it fared? U Thant gives a frank answer";United Nations. Secretary-General, 1961-1971 (Thant)
78210;1965;60635;[10];New strategy for development;UNESCO. Director-General, 1962-1974 (Maheu, R.)
78210;1965;60636;[12, 13, 14, 16, 17];Technical co-operation in a world of change;Owen, David
78210;1965;60637;[20, 21, 22, 23, 24];The Great revolution;Lippmann, Walter
78210;1965;60638;[24, 25, 26];Science, a new social force;Millionshchikov, Mikhail
78210;1965;60639;[27, 28, 29];UNESCO metamorphosis;
78211;1965;60652;[4, 5, 6, 10];Thief-proofing our art museums;LeBlanc, Richard
78211;1965;60653;[8, 9];Interpol theft warnings alert police in 95 countries;
78211;1965;60654;[11, 12, 13];Mona Lisa: V.I.P. protection par excellence;
78211;1965;60656;[14, 15];57 oil paintings lost in a single robbery;
78211;1965;60660;[16, 17];Havoc wrought by vandals;
78211;1965;60661;[18, 19, 20, 21, 22, 23, 30];Confronting the irascible Irazu;Tazieff, Haroun
78211;1965;60662;[24, 25, 26, 27, 28, 29];Dismantling Abu Simbel;Christophe, Louis A.
78211;1965;60663;[30, 31];World congress spurs fight against illiteracy;
78424;1965;60665;[4, 5, 6, 7, 8, 9, 39, 40];The Step to man;Platt, John R.
78424;1965;60666;[10, 11, 12, 13, 14, 15];Africa;Leiris, Michel
78424;1965;60671;[16, 17, 18];Oceania;Girard, Françoise
78424;1965;60673;[27, 28, 29, 30];Pre-Columbian America;Lehmann, Henri
78424;1965;60676;[31, 32, 33, 34, 35];Masterpieces of ancient Mexico;
78424;1965;60677;[36, 37, 38];The Gulf stream of the Pacific;Fedorov, Konstantin Nikolayevich
60703;1984;60704;[4, 5, 6, 7];The Big bang;Gribbin, John R.
60703;1984;60705;[8, 9, 10];The Infinitely big and the infinitesimally small;Nanopoulos, Dimitri V.
60703;1984;60706;[13, 14, 15];Was there really a big bang?;Narlikar, Jayant V.
60703;1984;60708;[17, 18, 23, 24];Galaxies and quasars;Henbest, Nigel
60703;1984;60709;[19];The Stellar menagerie;Henbest, Nigel
60703;1984;60710;[20, 21, 22, 23];The Life and death of a star;
60703;1984;60711;[24, 25, 26];The Structure of the universe;Zeldovich, Yacov Borissovich
60703;1984;60712;[28, 29];The Origin of the elements;
60703;1984;60713;[31, 32, 33, 34, 35];The Mystery of life;Sagan, Carl
60703;1984;60714;[36, 37];A Telescope in space;Ducrocq, Albert
60718;1984;60719;[4, 5, 6];The Fragile art of film;Borde, Raymond
60718;1984;60720;[7, 8];Africa: the images that must not fade;Vieyra, Paulin Soumanou
60718;1984;60721;[9];Egypt's national film archive;Osman, Khaled
60718;1984;60722;[10, 11];The Nitrate ultimatum;Edmondson, Ray|Schou, Henning
60718;1984;60723;[12, 13];The Electronic alternative;Powers, Kerns H.
60718;1984;60724;[14, 15, 16];"Napoleon makes a come-back; a rediscovered epic of the silent screen";Malkin, Roy
60718;1984;60727;[17, 18, 19];Wanted: the search is on for the world's missing films;Kula, Sam
60718;1984;60728;[20, 21];The Video grapevine;Manzi, Italo
60718;1984;60729;[22, 23];India: it's never too late;Nair, Paramesh Krishnan
60718;1984;60730;[24, 25];Thailand: when the camera was king;Sukvong, Dome
60718;1984;60733;[25];Cuba: a people in its pictures;Pereira, Manuel
60718;1984;60734;[26, 27, 28];Cine qua non: an ABC of film preservation;Schmitt, Frantz
60718;1984;60735;[29];Switzerland: a living film archive;Buache, Freddy
60718;1984;60736;[27];Birth of a notion;Matuszewski, Boleslav
60718;1984;60737;[30, 31];The Gosfilmofond of Moscow;Dmitriev, Vladimir Yurevich
60718;1984;60739;[32, 33];UNESCO and the preservation of moving images;Klaue, Wolfgang
60718;1984;60740;[34];The International Federation of Film Archives;Daudelin, Robert
59301;1968;61051;[30, 31];Men, women: new letters of credit;
59301;1968;61092;[2];The Odyssey of the human conscience;UNESCO. Director-General, 1962-1974 (Maheu, R.)|International Conference on Human Rights Teheran 1968
78237;1968;61095;[2];Appeal addressed to UNESCO's Member States by the International Consultative Liaison Committee for Literacy;Pahlavi, Ashraf|International Consultative Liaison Committee for Literacy
74684;1984;61118;[18, 19, 20];Enchanted seashell': a portrait of Old Havana;Pereira, Manuel
74684;1984;61119;[14, 15, 16, 17];The Legacy of colonial art;Bayón, Damián
74684;1984;61120;[9, 10, 11, 12, 13];"A Labyrinth of forms; the pre-Hispanic culture of Peru";García Ruiz, Jesús F.
74684;1984;61121;[4, 5, 6, 7, 8];The Sacred and the profane: two faces of Meso-American art;Soustelle, Jacques
74681;1984;61122;[31, 32, 33, 34];A World athirst for oil: from square-rigger to supertanker;Labouret, Vincent
74681;1984;61123;[30];The Slave trade;Kedros, André
74681;1984;61124;[26, 27, 28, 29];Retracing the caravan routes of East Africa: from Kilwa to Zimbabwe;Mbwiliza, Joseph Frederick
74681;1984;61125;[25];Sea, silk and sutras;Tang, Rinnie|Colombel, Pierre
74681;1984;61126;[22, 23, 24];A Silken highway from East to West: from Cathay to Antioch;Ma Yong
74681;1984;61127;[20, 21];"The Life of spice; cloves, nutmeg, pepper, cinnamon";Khoo Joo Ee
74681;1984;61128;[16, 17, 18, 19];Fair city of Flanders: Bruges, a Medieval centre of commerce;Morren, Paul
74681;1984;61129;[13, 14, 15];"Forever amber; from the Baltic to the Levant";Raunig, Walter
74681;1984;61130;[10, 11, 12];Was there a 'tin road' across Europe 2,500 years ago? From Cornwall to Corinth;Schwab, Hanni
74684;1984;61132;[37, 38, 39, 40, 41, 42, 43, 44, 45, 46];The Artistic ferment of a continent;Rodríguez Saavedra, Carlos
74684;1984;61133;[36];Castles in the air: Haiti's painters of high spirits;Depestre, René
74684;1984;61134;[35];The Dance of death;Rojas Mix, Miguel A.
74684;1984;61135;[34];The Master-craft workers of Mexico;Lanz de Ríos, Anharad
74684;1984;61136;[32, 33];The Originality of Peruvian popular art;Solari, Manuel Checa
74684;1984;61137;[31];The Bread (and butter) art of Ecuador;Adoum, Jorge Enrique
74684;1984;61138;[30];Armando Reverón: a lust for light;Calzadilla, Juan
74684;1984;61139;[29, 30];The Vibrant world of Cándido Portinari;Calado, Antonio Carlos
74684;1984;61140;[22, 27];Four artists in chiaroscuro;Glissant, Edouard
74684;1984;61141;[21, 28];Brasilia, 'the capital of hope';Bica, Briane Elisabeth Panitz
60703;1984;61178;[16];Red shift and the Doppler effect;
60703;1984;61179;[16];Hubble's Law;
61392;1984;61256;[4];The Gypsy destiny;UNESCO. Director-General, 1974-1987 (M'Bow, A.M.)
61392;1984;61259;[5, 6, 7];The World their homeland;Vaux de Foletier, François de
61392;1984;61262;[8, 9, 10];The Gaduliya Lohars: India's wandering blacksmiths;Cobas Puente, Esteban
61392;1984;61263;[11, 12, 13, 14];Bridging the culture gap;Charlemagne, Jacqueline
61392;1984;61278;[15, 16, 17];The Gypsy craftsmen of Europe;Tomka, Miklós
61392;1984;61283;[18, 19, 20];The Sharing, caring family;Janush, Rosa Taikon
61392;1984;61284;[21, 22, 23];A Wandering voice;Soravia, Giulio
